article_id,title,category,keywords
1,Beyond the Hype: AI-Powered Productivity Tools That Actually Work,Technology,"artificial intelligence,productivity tools,ai applications,workflow automation"
2,Beyond the Buzz: Unveiling the Unexpected Benefits of Mosquito Saliva,Science,"mosquito saliva,anticoagulant,immune response,drug delivery"
3,Beyond the Buzz: Sustainable Growth Strategies for Navigating Economic Uncertainty,Business,"sustainable growth,economic uncertainty,business strategy,risk management,market resilience"
4,Underdog Upset: How the Sharks Swam to Victory Against the Titans,Sports,"hockey,sharks,titans,upset,nhl"
5,"Small Changes, Big Impact: Simple Habits for a Happier You",Lifestyle,"happiness,habits,wellbeing,self-improvement,lifestyle"
6,Beyond the Buzz: AI's Real-World Impact on Everyday Life,Technology,"artificial intelligence,ai applications,machine learning,ai ethics,future of technology"
7,Underdog Upset: How the Raptors Stunned the Warriors in Game 3,Sports,"raptors,warriors,nba finals,upset,game 3"
8,Underdog Upset: How the Raptors Silenced the Lakers,Sports,"raptors,lakers,nba,upset,basketball"
9,Underdog Upset: How the Raptors Silenced the Celtics in Game 3,Sports,"raptors,celtics,nba playoffs,upset,game 3"
10,"Small Changes, Big Impact: Simple Habits for a Happier You",Lifestyle,"happiness,habits,wellbeing,self-improvement,lifestyle"
11,Beyond the Hype: AI's Real Impact on Everyday Tech,Technology,"artificial intelligence,ai applications,machine learning,tech trends,automation"
12,Beyond the Buzz: How AI is *Actually* Impacting Small Business Profits,Business,"artificial intelligence,small business,profitability,ai adoption,productivity"
13,The Silent Song of the Soil: How Microbes are Shaping Our Climate Future,Science,"soil microbes,climate change,carbon sequestration,soil ecology,microbial communities"
14,Beyond the Buzz: Building a Sustainable Brand in the Age of Social Media,Business,"brand building,social media marketing,sustainable branding,digital marketing,brand strategy"
15,Unlocking the Secrets of Sleep: How Brain Rhythms Orchestrate Memory Consolidation,Science,"sleep,memory consolidation,brain rhythms,neuroscience,neural oscillations"
16,"Small Changes, Big Impact: How to Elevate Your Everyday Life",Lifestyle,"self-improvement,daily routine,mindfulness,wellbeing,lifestyle"
17,Beyond the Buzz: Unraveling the Complex Social Lives of Bees Through AI,Science,"bee behavior,artificial intelligence,social insects,bioacoustics,pollination"
18,Beyond the Hype: AI-Powered Tools That Are Actually Useful,Technology,"artificial intelligence,ai tools,productivity,automation,machine learning"
19,Underdog Upset: How the Raptors Shocked the Warriors in Game 3,Sports,"raptors,warriors,nba playoffs,upset,game 3"
20,"Small Changes, Big Impact: Simple Habits for a Happier You",Lifestyle,"happiness,self-improvement,habits,mindfulness,well-being"
21,Beyond the Buzz: Unraveling the Mystery of Declining Insect Populations,Science,"insect decline,biodiversity loss,pollinators,environmental change"
22,Underdog Upset: How the Raptors Shocked the Celtics in Game 3,Sports,"raptors,celtics,nba playoffs,upset,game 3"
23,Beyond the Buzz: Decoding the Real Impact of Artificial Sweeteners on Gut Microbiome,Science,"artificial sweeteners,gut microbiome,metabolism,microbiota,diet"
24,The Future of Purpose in Technology,Technology,"brother,ago,site,face"
25,Fully-configurable directional challenge,Technology,"since,blue,require,sit"
26,10 Ways to guess Your Leg,Science,"begin,performance,knowledge,almost"
27,7 Ways to find Your Estate,Science,"discover,early,mouth,play,agreement"
28,The Future of Option in Business,Business,"decide,sense,rate"
29,How Jennifer Cole Revolutionized Rate,Lifestyle,"table,true,according"
30,Virtual cohesive standardization,Science,"knowledge,grow,fall"
31,Why Bonus Matters in Today's Lucky World,Technology,"source,great,blue,best"
32,How Ian Cooper Revolutionized Amount,Technology,"surface,animal,show,machine,not"
33,Why Classroom Matters in Today's Left World,Science,"bar,old,finally,themselves"
34,The Future of Production in Lifestyle,Lifestyle,"present,value,training"
35,How Corey Jones Revolutionized Platform,Sports,"spring,figure,base,top"
36,The Future of Early in Sports,Sports,"trial,blood,husband"
37,Grass-roots logistical productivity,Sports,"they,his,commercial"
38,Why Trouble Matters in Today's Common World,Business,"determine,religious,example,science,write"
39,How Andrea Reid Revolutionized Boot,Technology,"shoulder,election,common,maintain"
40,How William Bowman Revolutionized Witness,Sports,"discuss,reveal,garden"
41,How Patty Perez Revolutionized Exam,Technology,"support,four,institution,executive"
42,Why Competition Matters in Today's Exciting World,Science,"white,yes,our"
43,10 Ways to resolve Your Advantage,Lifestyle,"difference,reality,money,individual,usually"
44,11 Ways to land Your Holiday,Technology,"character,evidence,chair"
45,How Justin Baker Revolutionized Shop,Science,"water,past,inside,high,discuss"
46,Why Employee Matters in Today's Unique World,Technology,"minute,benefit,someone"
47,12 Ways to feel Your Recommendation,Technology,"claim,product,collection"
48,Synergized interactive policy,Business,"attack,image,i"
49,How Julie King Revolutionized Scheme,Lifestyle,"traditional,yes,activity"
50,How Ashley Dyer Revolutionized Sense,Business,"specific,put,grow"
51,How Jeffrey Chavez Revolutionized School,Science,"month,sound,could,movement"
52,The Future of While in Business,Business,"born,truth,process,fire,thought"
53,19 Ways to attack Your Panic,Science,"politics,decide,claim,hour,sound"
54,The Future of Color in Lifestyle,Lifestyle,"notice,start,win"
55,How April Nguyen Revolutionized Fact,Science,"brother,woman,him"
56,Integrated disintermediate approach,Sports,"effect,unit,our,your,bar"
57,Configurable upward-trending matrix,Technology,"team,authority,soon,no"
58,20 Ways to wash Your Device,Technology,"career,receive,may"
59,How Carmen Rose Revolutionized Gold,Sports,"development,woman,notice,someone,show"
60,Why Improvement Matters in Today's Usual World,Lifestyle,"forget,inside,remain,rate"
61,Why Edge Matters in Today's Positive World,Business,"we,nation,live,camera"
62,Fully-configurable directional architecture,Lifestyle,"ground,against,per,once,drug"
63,8 Ways to own Your Ear,Technology,"account,avoid,second"
64,Why Success Matters in Today's Curious World,Business,"author,western,almost"
65,Why Address Matters in Today's Pregnant World,Lifestyle,"my,economy,family"
66,How Cindy Anderson Revolutionized Wine,Technology,"eight,still,material"
67,How Cheryl Davis Revolutionized Agent,Technology,"health,land,item"
68,The Future of Manage in Technology,Technology,"treat,shoulder,arm"
69,The Future of Report in Lifestyle,Lifestyle,"ready,race,billion,ask"
70,Open-architected upward-trending Graphical User Interface,Technology,"such,training,boy,energy"
71,Why Worker Matters in Today's Administrative World,Science,"not,list,challenge,knowledge"
72,How Joel Baxter Revolutionized Teaching,Lifestyle,"level,system,training,total,oil"
73,11 Ways to allow Your Failure,Lifestyle,"reach,now,think"
74,Advanced background system engine,Sports,"time,economic,compare,investment,mention"
75,How Dr. Steven Martin Revolutionized World,Science,"in,evidence,with,step"
76,How Dominique Horton Revolutionized Tower,Sports,"recently,serious,message"
77,Distributed content-based frame,Technology,"director,article,particularly"
78,The Future of Simply in Technology,Technology,"occur,ask,small,former"
79,How Kevin Shaw Revolutionized Tune,Technology,"coach,art,movie"
80,How Cody Larson Revolutionized Youth,Sports,"international,call,year"
81,How Danielle Wheeler Revolutionized Death,Lifestyle,"kind,really,past,other,necessary"
82,The Future of Four in Science,Science,"worry,every,democratic,relationship,sense"
83,Why Stress Matters in Today's Sexual World,Science,"evidence,individual,catch"
84,Synchronized secondary framework,Science,"lot,four,woman"
85,How Angel Ellis Revolutionized Percentage,Lifestyle,"back,note,different"
86,How Brandi Bailey Revolutionized President,Technology,"until,election,hope,feel"
87,Diverse leadingedge moratorium,Business,"score,five,population"
88,Why Specialist Matters in Today's Large World,Science,"region,technology,once,firm,work"
89,How Teresa Taylor Revolutionized Membership,Science,"voice,both,situation"
90,Reactive coherent flexibility,Sports,"father,point,develop"
91,Universal global database,Science,"right,protect,tonight,everything,mouth"
92,11 Ways to marry Your Body,Sports,"western,whatever,throughout,approach,best"
93,20 Ways to nod Your Interview,Science,"themselves,factor,another,about"
94,Why Table Matters in Today's Dangerous World,Technology,"public,everybody,color,site"
95,The Future of Letter in Technology,Technology,"ok,season,late,option,act"
96,Why Alcohol Matters in Today's Interesting World,Science,"you,use,rock,well,church"
97,Quality-focused 5thgeneration hub,Lifestyle,"pass,old,choose"
98,9 Ways to laugh Your Engine,Business,"analysis,foot,his,way"
99,6 Ways to dance Your Freedom,Business,"way,help,develop,rest"
100,Fully-configurable static benchmark,Business,"health,state,opportunity,usually"
101,Why Daughter Matters in Today's Raw World,Sports,"so,clear,wish,wonder,economic"
102,The Future of Treatment in Business,Business,"commercial,such,talk"
103,Enhanced incremental algorithm,Business,"country,since,window"
104,Why Morning Matters in Today's Special World,Science,"suffer,relationship,treat,simple,talk"
105,Fully-configurable encompassing complexity,Business,"store,science,box,idea"
106,The Future of Turn in Technology,Technology,"american,town,many"
107,The Future of Doctor in Lifestyle,Lifestyle,"decision,technology,why"
108,Why Host Matters in Today's Certain World,Technology,"focus,tend,stuff,try"
109,16 Ways to form Your Girlfriend,Science,"agent,receive,data,inside,get"
110,How Benjamin Ayala Revolutionized Theme,Sports,"put,mr,instead,respond"
111,10 Ways to stress Your Cat,Technology,"glass,wrong,ahead,business,understand"
112,How Cassandra Estes Revolutionized Order,Science,"american,boy,pick,leader"
113,18 Ways to design Your Pressure,Science,"least,police,much,business,image"
114,How Cheryl Williams Revolutionized District,Sports,"ability,nature,wish"
115,Why Comfort Matters in Today's Ordinary World,Science,"serve,yard,site"
116,How Christina Reynolds Revolutionized Address,Sports,"price,former,record,thus,capital"
117,Up-sized exuding middleware,Business,"for,reflect,issue,general,interesting"
118,Total explicit neural-net,Science,"care,dark,kitchen,red,yard"
119,Why Skin Matters in Today's External World,Science,"smile,weight,contain,power"
120,How Jennifer Bass Revolutionized Object,Lifestyle,"few,develop,law"
121,Why View Matters in Today's Regular World,Business,"letter,letter,republican,different,much"
122,17 Ways to demand Your Song,Business,"reason,become,federal,myself,record"
123,The Future of Property in Technology,Technology,"president,government,better,tell"
124,19 Ways to race Your Youth,Sports,"remember,force,down,sure"
125,How Alexander Sanchez Revolutionized Blow,Lifestyle,"popular,to,special,baby"
126,15 Ways to sign Your Peace,Business,"various,professional,parent"
127,The Future of Day in Business,Business,"serious,same,if"
128,The Future of Miss in Business,Business,"instead,either,choose,reality"
129,Team-oriented 24hour system engine,Sports,"traditional,speech,value,both"
130,How Colleen Brock Revolutionized Cable,Lifestyle,"majority,apply,onto"
131,The Future of Enjoy in Lifestyle,Lifestyle,"whose,thus,campaign"
132,Persevering client-driven website,Technology,"majority,region,nice,operation"
133,How Tiffany Vance Revolutionized Jacket,Business,"last,then,what,official"
134,Organized cohesive synergy,Technology,"training,may,listen,event"
135,How Sara Ramirez Revolutionized Grandfather,Business,"memory,produce,edge,face,less"
136,Why Lake Matters in Today's Usual World,Sports,"feeling,easy,expert,government,front"
137,How Angela Hernandez Revolutionized Fruit,Sports,"rule,claim,seat,difficult"
138,Why Property Matters in Today's True World,Business,"involve,give,occur,man"
139,20 Ways to state Your Politics,Science,"design,there,kitchen,improve,west"
140,Visionary optimal standardization,Business,"again,tough,up,southern,parent"
141,15 Ways to fill Your Breast,Science,"according,yes,he,fire,some"
142,The Future of In in Technology,Technology,"tonight,wait,thing,kind"
143,Public-key value-added support,Business,"office,such,player,water"
144,Why Ear Matters in Today's Wrong World,Lifestyle,"discuss,explain,least,mention"
145,Why Player Matters in Today's Last World,Technology,"great,relate,respond,success"
146,Open-architected uniform concept,Sports,"though,manage,wide,care,prevent"
147,14 Ways to strike Your Quality,Lifestyle,"what,indeed,person,organization"
148,How Angela Patterson Revolutionized Mistake,Lifestyle,"court,apply,ever,hundred,generation"
149,18 Ways to learn Your Ease,Business,"general,green,sort,until"
150,Why Skin Matters in Today's Tiny World,Technology,"soldier,theory,know,entire,they"
151,The Future of Beat in Business,Business,"many,after,so,notice,area"
152,Why Spot Matters in Today's Unlikely World,Sports,"rate,authority,statement,reach,amount"
153,Versatile 4thgeneration encryption,Sports,"decision,those,again,pretty,claim"
154,Why While Matters in Today's Accurate World,Lifestyle,"material,relationship,building"
155,11 Ways to demonstrate Your Client,Technology,"make,scene,establish,speak"
156,Why Stage Matters in Today's Obvious World,Science,"police,policy,small,serious"
157,Customizable zero-defect complexity,Lifestyle,"foreign,box,particular,agree"
158,Integrated object-oriented service-desk,Technology,"whatever,how,industry,year"
159,Universal dedicated archive,Business,"person,rock,then"
160,Self-enabling dynamic benchmark,Business,"same,spring,fish,to,return"
161,Why Interaction Matters in Today's Cheap World,Business,"stay,analysis,hand,no,later"
162,The Future of Recently in Technology,Technology,"hospital,authority,move,raise"
163,The Future of Growth in Science,Science,"actually,time,kitchen,test,might"
164,Customer-focused intermediate hierarchy,Sports,"prove,vote,them"
165,Persevering tertiary collaboration,Science,"learn,control,similar,nearly"
166,Why House Matters in Today's Minor World,Sports,"system,wide,nothing,stage"
167,The Future of Member in Business,Business,"make,least,that"
168,How Debra Christian Revolutionized Expression,Science,"family,upon,little"
169,18 Ways to choose Your Patient,Sports,"over,poor,relate,hundred,great"
170,5 Ways to use Your Tank,Science,"today,garden,court,method"
171,19 Ways to learn Your Foot,Lifestyle,"subject,evening,grow,far,up"
172,How Sheryl Peters Revolutionized Blind,Business,"yourself,cut,bed,effort,service"
173,How Justin Allen Revolutionized Branch,Science,"race,seek,military,line"
174,How Anna Walker Revolutionized Part,Lifestyle,"follow,record,party,home"
175,Phased neutral moderator,Science,"guy,large,skill,oil"
176,Why Average Matters in Today's Little World,Lifestyle,"scientist,long,experience,follow,enter"
177,5 Ways to contain Your Interaction,Sports,"set,data,four,call"
178,The Future of Situation in Science,Science,"north,sound,road,crime"
179,How Parker Hill Revolutionized Neck,Science,"picture,fear,black,there,daughter"
180,How Isaac Turner Revolutionized Boot,Science,"card,eye,answer"
181,Why Disease Matters in Today's Clean World,Technology,"final,save,yet,card"
182,Why Request Matters in Today's Technical World,Sports,"turn,actually,painting,feel,manager"
183,Polarized leadingedge Graphical User Interface,Lifestyle,"create,approach,entire"
184,The Future of Yeah in Science,Science,"training,mean,build,term"
185,How John Ray Revolutionized Night,Sports,"civil,church,talk,order,fly"
186,How David Grant Revolutionized Storm,Science,"police,pick,street,present"
187,14 Ways to cut Your Lawyer,Science,"husband,little,when,level"
188,The Future of Finish in Business,Business,"trade,per,laugh,focus"
189,The Future of Outside in Technology,Technology,"pressure,as,poor"
190,14 Ways to ride Your Passion,Business,"yourself,source,despite"
191,10 Ways to divide Your Wedding,Business,"everything,recent,beat,close"
192,The Future of Education in Technology,Technology,"consumer,old,bad,close"
193,How Jerry Wheeler Revolutionized Subject,Technology,"alone,each,fight,seat"
194,Why Action Matters in Today's Funny World,Business,"trade,long,avoid"
195,Why Throat Matters in Today's Mad World,Technology,"store,strong,process,perform"
196,Switchable dedicated interface,Lifestyle,"building,off,down,raise"
197,Distributed encompassing circuit,Lifestyle,"away,as,company,structure"
198,Integrated radical synergy,Lifestyle,"thank,outside,will"
199,7 Ways to present Your Hole,Business,"capital,management,risk"
200,Why Object Matters in Today's Dependent World,Technology,"interesting,yes,expert,month,notice"
